<?xml version="1.0" encoding="UTF-8"?>
<seqTemplate xmlns:xsi="http://www.w3.org/2001/XMLSchema-instance"
    xsi:noNamespaceSchemaLocation="../xsd/seq_template.xsd" identifier="linearpath">
    <metadata>
        <version> 1.0</version>
        <thumbnail>linear_path.png</thumbnail>
        <title>Linearerd</title>
        <description>Erzeugt einen linearen Lernpfad. Der Lerner kann die Kapitel nicht frei w√§hlen.
         </description>
        <replacenode>false</replacenode>
    </metadata>
    <item type="lesson">
        <title>Linearer Lernpfad</title>
        <sequencing>
            <controlMode flow="true" choice="false" forwardOnly="false"/>
        </sequencing>
        <item type="sco">
            <title>SCO 1</title>
            <sequencing>
                <objectives>
                    <primaryObjective objectiveID="Lernziel SCO 1"/>
                </objectives>
            </sequencing>
        </item>
        <item type="sco">
            <title>SCO 2</title>
            <sequencing>
                <objectives>
                    <primaryObjective objectiveID="Lernziel SCO 2"/>
                </objectives>
            </sequencing>
        </item>
        <item type="sco">
            <title>SCO 3</title>
            <sequencing>
                <objectives>
                    <primaryObjective objectiveID="Lernziel SCO 3"/>
                </objectives>
            </sequencing>
        </item>
    </item>
</seqTemplate>
